{
  "schema": "identity.profile/v0",
  "id": "tokens",
  "version": "0.1.0",
  "verified_at": "2026-08-14",
  "references": ["https://www.designtokens.org/tr/2025.10/format/"],
  "targets": [
    {
      "id": "design-tokens",
      "path": "tokens/design-tokens.json",
      "format": "json",
      "source_role": "palette",
      "description": "Canonical Design Tokens Community Group interchange document."
    },
    {
      "id": "css-custom-properties",
      "path": "tokens/identity.css",
      "format": "css",
      "source_role": "palette",
      "description": "Generated semantic CSS custom properties."
    },
    {
      "id": "token-reference",
      "path": "tokens/README.md",
      "format": "markdown",
      "source_role": "palette",
      "description": "Human-readable token meanings and accessibility constraints."
    }
  ]
}
